{"schemaVersion":"dromio.purge-receipt.v1","id":"purge-1","tenantId":"tenant-1","applicationId":"app-1","threadId":"thread-1","deletedResources":{"items":2},"propagationTargets":["search"],"propagation":{"search":{"status":"completed","completedAt":"2026-01-01T00:00:01Z"}},"status":"completed","purgedAt":"2026-01-01T00:00:00Z","completedAt":"2026-01-01T00:00:01Z","purgedBy":{"type":"user","id":"user-1"}}
